{
  "schema_version": "2.0",
  "artifact_type": "canonical_revision",
  "project_id": "coar-demo",
  "created_at": "2026-07-14T12:00:00Z",
  "updated_at": "2026-07-14T12:00:00Z",
  "extensions": {},
  "revision": 0,
  "transaction_id": null,
  "published_trial_id": null,
  "content_hash": "0000000000000000000000000000000000000000000000000000000000000000"
}
